definition, note
An attack on someone's personality or lifestyle
Attacking someone's character or appearance instead of focusing on the topic.
An attack on the character of a person, rather than on his arguments or opinions.
Which logical fallacy attacks the person who is saying something, rather than considering the content of what the person is saying?
Presents only two choices when more options exist
"Attacks the arguer instead of the argument"
, motive, or other attribute of the person making the argument.
This fallacy attacks a position the opponent doesn’t really hold.
This fallacy is a distraction from the argument typically with some sentiment that seems to be relevant but isn’t really on-topic.
